review_id,publish_date,rating,company_size,job_title,full_content,is_ai_relevant
10346596,2024-10-09T00:00:00,5.0,Small-Business(50 or fewer emp.),Client Engagement Team Lead at Kno2,"What do you like best about Intercom?
We use Intercom all day every day as the center of our support operations. I love how easily we can support 18k + active customers as well as multiple partners with a support team of 6 people, half of which don't have to live in Intercom all day. It wouldn't be possible without Intercom's automations, workflows, integrations, and Fin. Our customers and partners love our support.

What do you dislike about Intercom?
I wish there was more control over the spam filter. I would like to only have things I mark as spam go there, as we regularly lose legitimate emails into there. It's not always easy to remember to check it.

What problems is Intercom solving and how is that benefiting you?
We have a very small team, but we want to provide excellent customer service to a large amount of users and partners. Intercom allows us to accomplish that easily without having to hire more employees.",True
10656854,2024-12-17T00:00:00,4.5,Small-Business(50 or fewer emp.),Support,"What do you like best about Intercom?
The IA partner are very good when contugiration correct. Do not know about me the valor of, but seeing the IA in chat makes thinks more easily.

What do you dislike about Intercom?
The automation costumer distribution, i think the distribuition need to have more option them just the old to new ones

What problems is Intercom solving and how is that benefiting you?
The problem are not the program, but the way that program was use by my organization. I see future for the intercom",True
10616223,2024-12-06T00:00:00,5.0,Small-Business(50 or fewer emp.),Project Manager,"What do you like best about Intercom?
The best about Intercom is easy of usability. Intercom is a feature rich platform and allows easy integration to salesforce and its best to create internal tickets to support various teams

What do you dislike about Intercom?
Intercoms own support is very limited and does not live upto their expectations

What problems is Intercom solving and how is that benefiting you?
Intercom is solving issues for help desk and since the time of using Intercomm, we have benefitted immensly by resolving the issues on time because of ease of platform usability",False
10320544,2024-10-04T00:00:00,5.0,Mid-Market(51-1000 emp.),Director of Customer Success,"What do you like best about Intercom?
The team at intercom is always there to help. As we have grown our company intercom has been a key partner in it. FIN has bee huge for us in scaling our team and providing better service to our clients. We have been able to close of 50% of conversations with AI and keep an 85% CSAT score on those AI conversation. Intercom allows our team keep up with clients everyday. We are able to support 3 different products with one intercom installation.

What do you dislike about Intercom?
The pricing structure can be confusing to understand

What problems is Intercom solving and how is that benefiting you?
Intercom is our primary communication tool with our clients and for in-app education.",True
9854731,2024-07-01T00:00:00,5.0,Small-Business(50 or fewer emp.),COO,"What do you like best about Intercom?
HIPAA compliant without a massive cost.
AI that can actually help my users.
Useful and clean product walkthrough features.
Easy to build help desk articles.
All on one platform with good UI.
Startup discount.
Pricing for AI chat bot feels simple and fair.
Easy to get set up.

What do you dislike about Intercom?
Startup discount is great but won't get you HIPAA compliance.
Usage based pricing can be difficult to model future cost to company.
Have to have an active seat for any engineers who are just setting up product walkthroughs even if they aren't providing customer support.
App doesn't seem to consistently send notifications for incoming live chats.

What problems is Intercom solving and how is that benefiting you?
The product walkthrough feature has made our product much more accessible to a wide audience of users with varrying tech savviness. Live chat is super simple to use. The AI chatbot solved its first customer support ticket autonomously last week and it only took 5 minutes to setup, absolutely incredible. Help desk was also easy to setup and very useful for customers.",True
4251183,2024-11-05T00:00:00,5.0,Small-Business(50 or fewer emp.),Co-Founder,"What do you like best about Intercom?
Great support tool, great support team (there's a minimum number of characters on the questions. that's very weird)

What do you dislike about Intercom?
I had high hopes for the Intercom Product tours. It's ok overall but has some minuses. I can see you're working on it, and the support team has been great in delivering our feedback to the product team. So I am waiting on the improvements :)

Recommendations to others considering Intercom:
Do it

What problems is Intercom solving and how is that benefiting you?
We're mostly handling support, but we want to ramp up our onboarding with the product tours. So far we could only use it sparingly due to some limitations such as product tours not starting if users aren't logged in and need to go through the login process; menu items (e.g. File>New) aren't recognised when you hover over them, etc",True
10565946,2024-11-26T00:00:00,5.0,Mid-Market(51-1000 emp.),Customer Concierge,"What do you like best about Intercom?
The AI that can effortlessly improve my grammar and spelling. Additionally, it's offer a variety of options to enhance my writing, such as choosing a more friendly or formal tone.

What do you dislike about Intercom?
Nothing for now. Intercom is an incredibly user-friendly and convenient tool to utilize. It's truly a pleasure to use

What problems is Intercom solving and how is that benefiting you?
Whenever I struggle to articulate my thoughts, I have a fantastic AI tool at my disposal that can effortlessly improve my grammar and spelling. It's a lifesaver!",True
10257015,2024-10-28T00:00:00,5.0,Mid-Market(51-1000 emp.),Chat Customer Support,"What do you like best about Intercom?
What I like most about Intercom is how easy it is to navigate. I can easily view our team's CSAT standings using the ""Report"" option, and I can create and customize macros for easier customer interactions.

What do you dislike about Intercom?
As a person who always likes to customize my theme on every platform, I think it would be great if I could change my preferences to different styles and colors, in addition to the ""Light or Dark"" mode.

What problems is Intercom solving and how is that benefiting you?
It allows me to create and customize macros to provide my customers with a simpler approach.",False
10487245,2024-11-11T00:00:00,5.0,Small-Business(50 or fewer emp.),Customer Service Representative (Chat Support),"What do you like best about Intercom?
Intercom is the best customer service app that can really help to connect with our customers in the most convenient way. It's come so handy since there are quick links that will appear from the right-hand navigation bar to help our investigation in an easy way.

What do you dislike about Intercom?
There are some Intercom issues that will happen that can affect our quality performance.

What problems is Intercom solving and how is that benefiting you?
We help our customers to resolve their portal issues, and easy for us to help them investigate.",False
7888852,2024-11-07T00:00:00,4.5,Small-Business(50 or fewer emp.),NOT GIVEN,"What do you like best about Intercom?
I am using Intercom for a lot of time, have experience with other platforms, and I would like to say that Intercom is the best solution between functionality side and user-friendliness
The AI update is also a great feature!
And many others, such as to see who is checking the chat, ping, dark mode, etc.

What do you dislike about Intercom?
I wouldn't say I liked the thing when the user comes to the chat with the identical email but not logged-in in one of the times (like just an email response) and I will not see the previous history with the contact, even when the email matches.

What problems is Intercom solving and how is that benefiting you?
Easy communication with the users. Possibility to use it correctly with the team",True
9763848,2024-06-11T00:00:00,5.0,Mid-Market(51-1000 emp.),Technical Support Executive,"What do you like best about Intercom?
First of all the user interface is too good.
You can easily manage multiple chats at a time.
Chat taggig makes it easy for us to identify the categories of issue.
Most of the basic queries are handled by the Chat Bot which reduces the hassle.
It also allows us to monitor chats of other team members.

What do you dislike about Intercom?
We cannot chat with the client on behalf of other team members, if I need to transfer the chat midway to my colleague, customer gets to know that person who is handling a chat is now changed.
Sometimes, chatbot fails to assign chats to any of the available team members and chat remains unassigned without any notification.

What problems is Intercom solving and how is that benefiting you?
The chat bot in Intercom resolves some of the basic queries of the customers itself, without involving human which is great.
It reduces the number chats we need to handle at a time becasue of chat bot.
It allows us to creat macros which enables us to save message templates and send them quicly without typing them everytime.
It recognises opening message and we just need to press TAB to enter opening message.",True
10483463,2024-11-10T00:00:00,5.0,Mid-Market(51-1000 emp.),Technical Support Manager,"What do you like best about Intercom?
Fin is a game-changer! Configuring all workflows is very easy, and you can implement them in your product with a few clicks! We use Intercom every day, and Fin is doing the heavy work for us at the moment.

He helped our support team focus on more complex support issues and lifted almost 50% of our day-to-day job.

What do you dislike about Intercom?
Literally nothing! I have one: the ""waiting period"" for the new features to come!

What problems is Intercom solving and how is that benefiting you?
Incoming tickets/chats",True
10626406,2024-12-11T00:00:00,4.0,Small-Business(50 or fewer emp.),Configuration Engineer,"What do you like best about Intercom?
We can keep all client's support requests in one place, together with keeping the knowledge base.

What do you dislike about Intercom?
Could more intuitive, it is not. The way the areas are separated is not the best and I think is the reaosn why I think could be more intuitive.

What problems is Intercom solving and how is that benefiting you?
Maybe AI, but we are not super sure how to implement it strategically.",True
9736247,2024-06-01T00:00:00,4.5,Enterprise(> 1000 emp.),Support Specialists,"What do you like best about Intercom?
The vast keyboard shortcuts were the most helpful in the Intercom. Speaking with different customers makes your life faster and easier with just one click of a button, and you can already switch to a tab, or change your interface.

Another thing I love about Intercom is the new CoPilot feature. It is an AI but also user input so you are assured that you can modify your responses and choose from the best answers from your colleagues.

What do you dislike about Intercom?
It creates too many interaction. I hope it can identify and merge tickets immediately if a user created too many inquiries in a given instance.

What problems is Intercom solving and how is that benefiting you?
It helps me become more productive by being able to communicate with multiple customers at the same time. I can get up to 3 instances open and even pull more conversations as needed. This not only help me gain more knowledge and tickets but as well help the customers lessen their efforts when communicating with us since it helps them save time as well.",True
10341771,2024-11-20T00:00:00,4.5,Mid-Market(51-1000 emp.),Supervisor,"What do you like best about Intercom?
I like the interface to help me to find the chats and create a reports to check the performance to my team and overall all team.

What do you dislike about Intercom?
Sometimes is very slow, also in the flows need a good ram to work well.

What problems is Intercom solving and how is that benefiting you?
Intercom nos ha ayudado a poder automatizar mejor nuestro servicio, teniendo metricas claras y facilidad en la atencion e informacion.",True
10254424,2024-09-16T00:00:00,4.5,Small-Business(50 or fewer emp.),Digital Support Technician,"What do you like best about Intercom?
Simple layout for navigating different tickets and cases.

Easy implementation and integration with ongoing methods of casing.

Easy to respond to any customers and support them as needed.

Lots of different features, conversations for short chats, or tickets for bigger issues.

Using it daily, it has become our main port of customer contact.

What do you dislike about Intercom?
There have been no circumstances that make me particularly dislike a part of intercom, it is a very good platform for dealing with customer enquiries.

What problems is Intercom solving and how is that benefiting you?
Intercom allows me to properly save a case to differ between larger and smaller issues.",True
9228494,2024-12-10T00:00:00,4.5,Mid-Market(51-1000 emp.),Thryv Success Specialist,"What do you like best about Intercom?
Macros function is the best of it. I really like it.

What do you dislike about Intercom?
Some optimizations need to be done on it. I'd like to add ''export conversation'' as an action.

What problems is Intercom solving and how is that benefiting you?
The problem it solves is the fact hat some clients does not like to call. Using intercom's Chat, life becomes easy for them.",False
10479600,2024-11-08T00:00:00,5.0,Mid-Market(51-1000 emp.),NOT GIVEN,"What do you like best about Intercom?
I love that it is easy to use, very straightforward, has all of the tools that I need to do my job efficiently and effectively, and is so nice to be able to see my production and results. As a customer service representative, it has been amazing!

What do you dislike about Intercom?
It can be overwhelming because there is so much information and reports available, but I still love it because it gives me everything I need and is adaptable to my job.

What problems is Intercom solving and how is that benefiting you?
It has been the best tool for our customers and has made our jobs easier to chat with customers and solve their problems on this platform.",True
10650715,2024-12-16T00:00:00,5.0,Mid-Market(51-1000 emp.),NOT GIVEN,"What do you like best about Intercom?
UI is great. Possibilities when it comes to types of messaging (banners, emails, chats, popups). Our customer communication for product adoption and education is completely done via Intercom.

What do you dislike about Intercom?
Integration with Salesforce is not great. Creation of tasks via clicks on email is inconsistent to say the least.  Some asks that are not supposed to be created, are created, and those who are supposed to, are not.

What problems is Intercom solving and how is that benefiting you?
Segmentation when it comes to product and customer communication based on tags. Customer Marketing via invites to educational webinars.",True
10392240,2024-10-21T00:00:00,5.0,Small-Business(50 or fewer emp.),NOT GIVEN,"What do you like best about Intercom?
I use intercom everyday to talk to customers who need help, who have a question or really anything related to communication. When I started using it, I thought it was pretty good, but I didn't know the many other features it had to help me better structure my day to day with customers.

What I like the most is that even if Intercom is a big platform for giving support, their support is also very fast and accurate !

I like they communicate new features and ideas through their own channel, I can see what my customers are going to see if I activate the proactive support, or FinAI.

What do you dislike about Intercom?
Intercom is a complex product, and even though I don’t consider that to be a negative thing about it, sometimes I simply don't have the time to read through the articles. For more complicated paths like establishing rules I had a hard time finding the right information by going from one article to another.  Otherwise, is very easy to use and to understand !

What problems is Intercom solving and how is that benefiting you?
At the moment, we are using Intercom to help us structure our customer onboarding. Proactive support has been of great help to reduce basic support contact and give us time to focus on bigger problems.",True
10650263,2024-12-16T00:00:00,4.5,Mid-Market(51-1000 emp.),Product Manager,"What do you like best about Intercom?
We can send push and popup to mobile users easily and build email system logic

What do you dislike about Intercom?
Price high, some features are overpriced so we looked for another solution. Plus Intercom is blocked by Viettel service, so our users in Vietnam with Viettel telecom can't access customer center and view URL for our banners and articles.

What problems is Intercom solving and how is that benefiting you?
We use intercom for CRM, customer communication including email marketing, inapp popup, notification, etc. Intercom is easy to use and navigate for most of our internal stakeholders to find customer's queries.",True
9960706,2024-08-06T00:00:00,4.5,Small-Business(50 or fewer emp.),NOT GIVEN,"What do you like best about Intercom?
The user interface is easy to use and it's very intuitive. It allows in-platform user communication via number of channels, such as surveys, messages or banners as well as email and chatbot.

The articles and knowledge base that feed into the chatbot are very effective too. It's great to have a centralized place for customer communications and product marketing.

My team and I use Intercom nearly every day. It has been easy to implement and integrate with other channels, such as Slack.

What do you dislike about Intercom?
Being able to pick the exact elements of your subscription is a cost-efficient way to use the platform. But you can't effectively use some options without paying for others, so it feels like a constant upsell.

I had a mixed experience with customer support. The highly effective chatbot means that a lot of issues can be resolved in no time. But anytime I need to speak to a human it takes a long time to be connected. I have encountered a range of customer support agents too - some of them incredibly helpful, and others less so.

What problems is Intercom solving and how is that benefiting you?
The product tours have been an incredibly useful feature. It means that the tech team no longer has to spend time trying to build informative pop-ups in the platform. In turn, this means that marketing is fully in control of the content and everyone has far more flexibility.",True
10276755,2024-09-19T00:00:00,5.0,Mid-Market(51-1000 emp.),"Team Lead , Global Support","What do you like best about Intercom?
Over the years of using the intercom , it has been so user-friendly both for our client and as an agent . Integration -wise it made everything even smooth transitioning our chats to other ticketing tools we use . Additionally, we feel that the ease of convenience and accessibility somehow contributed to our happy clients as they can always reach out to us anytime hassle-free.

What do you dislike about Intercom?
One of the flaws I can consider to be disadvantage on my part , was during earlier days was lack or less customizations available . Like the AI , which does is not available back then .

What problems is Intercom solving and how is that benefiting you?
Currently, with the new introduction of AI ( Fin AI Copilot ), these really gave us the edge and smooth way to interact with our clients.",True
10527348,2024-11-18T00:00:00,5.0,Mid-Market(51-1000 emp.),Customer Success Associate,"What do you like best about Intercom?
Many effective tools that are very useful in providing customer support to many users.

What do you dislike about Intercom?
Their support can be a little hard to get a hold of and a few tools are missing key features like exporting data or walkthroughs of some complex tools. Either way, the pros far outweigh the cons.

What problems is Intercom solving and how is that benefiting you?
AI support, tools to improve efficiency, self service support.",True
9853317,2024-07-01T00:00:00,4.5,Small-Business(50 or fewer emp.),Product Marketing Manager,"What do you like best about Intercom?
As a product marketer, the ability to pin point specific segments of users to launch a wide variety of messages, pop-ups, chat bubbles, news articles, etc, makes it really easy to reach our customers and provide a consistent and seamless experience for them. Intercom makes it really simple to create a unified in-app and help center experience for our customers.

What do you dislike about Intercom?
I have come across a few bugs but they usually don't hold me back from getting projects done.

What problems is Intercom solving and how is that benefiting you?
Intercom solves the problem of being able to communicate to our customers directly and effienctly in the place that they work every day (our product). That is helpful for product marketing campaigns and feature launches to communicate what we need to customers so that we can have more successful product launches.",True
10411284,2024-10-25T00:00:00,5.0,Mid-Market(51-1000 emp.),Patient Concierge,"What do you like best about Intercom?
the AI generate responses and the template function make my life 100 times easier

What do you dislike about Intercom?
That I cannot go in and edit an email after creating a new user/lead. Sometimes I have a typo and instead of editing the email, I have to create a new user/lead entirely.

What problems is Intercom solving and how is that benefiting you?
It helps me with time management and makes it so I can use a marco instead of having to type out my messages everytime.",True
10054226,2024-08-27T00:00:00,5.0,Mid-Market(51-1000 emp.),Customer Experience Readiness Specialist,"What do you like best about Intercom?
Intercom is easy to use and allows great flexibility and control over your customer support. They regularly provide helpful updates for their product to enhance it's use.

What do you dislike about Intercom?
There is very little I dislike about Intercom. The cost per-assumed resolution with Fin is not always great as it can count for customers who drop off without truly being resolved.

What problems is Intercom solving and how is that benefiting you?
Intercom lets us provide fast support to our customers over email and chat. In addition, it also allows us to use Help Centres and Chatbots to reduce our inbound customer contacts. This frees up more time to work on the tricker problems.",True
10367087,2024-10-14T00:00:00,5.0,Small-Business(50 or fewer emp.),Brand Ambassador,"What do you like best about Intercom?
Is easily accessible and easy to use when completing a chat using the different macros and AI to make it easy to communicate with the customers

What do you dislike about Intercom?
I have never encountered something that I dislike about intercom.

What problems is Intercom solving and how is that benefiting you?
The time i use intercom is when we are communicating with customers who are enquiring about the business or services that we offer and it is convenient to use as we reach an understanding at the end of the day.",True
10029743,2024-08-20T00:00:00,4.5,Mid-Market(51-1000 emp.),Back Office Specialist,"What do you like best about Intercom?
How easy it is to use and how customizable their macros are, it allows to handle hundreds of chats a day with no great effort.
Another thing I love is the easy it is to implement in a new business.
It also allows to integrate another useful tools to obtain a high detail level on the conversations. It is also the tool I prefer to use daily to support the customers of the business.

What do you dislike about Intercom?
Sometimes the actions trigerred by keys can overlap and get a little messy.

What problems is Intercom solving and how is that benefiting you?
Getting all the channels the customer prefer in a tool that is easy to use.",True
10368049,2024-10-14T00:00:00,5.0,Small-Business(50 or fewer emp.),NOT GIVEN,"What do you like best about Intercom?
We've built out a really close customer engagement model by using Intercom for support, notifications, tooltips and more. The ability to make quick call outs with very little technical knowledge has been incredibly useful. I interact with Intercom almost every day to see requests, and track a few metrics.

What do you dislike about Intercom?
On the odd occasion, there have been a couple of limits on how I can run a product tour. Intercom needs the user to click ""next"" or go exactly where they are expected to, and to get around this takes a lot more effort with a ""series"". In so many ways the simplicity of Intercom is a strength, but on the odd occasion it could handle a slightly more advanced requirement.

What problems is Intercom solving and how is that benefiting you?
Intercom gives us a very human and rapid support process when customers have issues with our product. We have occasionally used Intercom for showing a banner when there was a known issue in our product, which we could do without using a developer or waiting for a hotfix. We run our product documentation through Intercom which has a fantastic ability to hide certain articles unless the user is logged in to our product.",True
